----------------------------------------------------------------------------
CrystalDiskInfo 8.12.0 (C) 2008-2021 hiyohiyo
                                Crystal Dew World: https://crystalmark.info/
----------------------------------------------------------------------------

    OS : Windows 10  [10.0 Build 19042] (x64)
  Date : 2021/05/19 23:18:03

-- Controller Map ----------------------------------------------------------
 + Controladora SATA AHCI estándar [ATA]
   - WDC WD5000LPLX-60ZNTT1
 - Controladora de espacios de almacenamiento de Microsoft [SCSI]

-- Disk List ---------------------------------------------------------------
 (01) WDC WD5000LPLX-60ZNTT1 : 500,1 GB [0/0/0, pd1]

----------------------------------------------------------------------------
 (01) WDC WD5000LPLX-60ZNTT1
----------------------------------------------------------------------------
           Model : WDC WD5000LPLX-60ZNTT1
        Firmware : 02.01A02
   Serial Number : WD-WXH1A974UHJ0
       Disk Size : 500,1 GB (8,4/137,4/500,1/500,1)
     Buffer Size : 32767 KB
     Queue Depth : 32
    # of Sectors : 976773168
   Rotation Rate : 7200 RPM
       Interface : Serial ATA
   Major Version : ACS-2
   Minor Version : ACS-3 Revision 3b
   Transfer Mode : SATA/600 | SATA/600
  Power On Hours : 5089 horas
  Power On Count : 2505 veces
     Temperature : 32 C (89 F)
   Health Status : Bueno
        Features : S.M.A.R.T., APM, NCQ
       APM Level : 0080h [ON]
       AAM Level : ----
    Drive Letter : C:

-- S.M.A.R.T. --------------------------------------------------------------
ID Cur Wor Thr RawValues(6) Attribute Name
01 200 200 _51 000000000000 Tasa de errores de lectura
03 151 143 _21 000000000599 Tiempo de arranque
04 _92 _92 __0 00000000215A Nº de ciclos de arranque/parada
05 200 200 140 000000000000 Nº de sectores reasignados
07 200 200 _51 000000000000 Tasa de errores de búsqueda
09 _94 _94 __0 0000000013E1 Horas encendido
0A 100 100 _51 000000000000 Nº de reintentos de giro
0B 100 100 __0 000000000000 Reintentos de calibración
0C _98 _98 __0 0000000009C9 Nº de ciclos de encendido del dispositivo
B7 100 100 __0 000000000000 Vendor Specific
B8 100 100 _97 000000000000 End-to-End Error
BB 100 _99 __0 000000000001 Reported Uncorrectable Errors
BC 100 100 __0 000000000000 Command Timeout
BE _68 _53 _40 0000221E0020 Temperatura del flujo de aire
BF __1 __1 __0 00000000018E Tasa de errores G-Sense
C0 200 200 __0 000000000298 Nº apagados del dispositivo
C1 197 197 __0 0000000024A1 Nº de ciclos carga/descarga
C2 111 _96 __0 000000000020 Temperatura
C4 200 200 __0 000000000000 Nº de eventos de recolocación
C5 200 200 __0 000000000000 Nº de sectores pendientes
C6 100 253 __0 000000000000 Nº de sectores no corregibles
C7 200 200 __0 000000000000 Número de errores CRC UltraDMA
C8 100 253 _51 000000000000 Tasa de errores de escritura

-- IDENTIFY_DEVICE ---------------------------------------------------------
        0    1    2    3    4    5    6    7    8    9
000: 427A 3FFF C837 0010 0000 0000 003F 0000 0000 0000
010: 2020 2020 2057 442D 5758 4831 4139 3734 5548 4A30
020: 0000 FFFF 0000 3032 2E30 3141 3032 5744 4320 5744
030: 3530 3030 4C50 4C58 2D36 305A 4E54 5431 2020 2020
040: 2020 2020 2020 2020 2020 2020 2020 8010 4000 2F00
050: 4001 0000 0000 0007 3FFF 0010 003F FC10 00FB 5100
060: FFFF 0FFF 0000 0007 0003 0078 0078 0078 0078 0D00
070: 0000 0000 0000 0000 0000 001F 8D0E 0006 004C 0040
080: 03FE 001F 706B 7C69 6123 7069 BC49 6123 407F 0024
090: 0024 0080 FFFE 0000 0000 0000 0000 0000 0000 0000
100: 6030 3A38 0000 0000 0000 0000 6003 0000 5001 4EE6
110: 0800 A44D 0000 0000 0000 0000 0000 0000 0000 401C
120: 401C 0000 0000 0000 0000 0000 0000 0000 0029 0400
130: 0001 0000 0000 0000 0000 0000 0000 0000 0000 0000
140: 0000 0000 0004 0000 0000 0000 0000 0000 0000 0000
150: 0000 0000 0000 0000 0000 0000 0000 0000 0000 0000
160: 0000 0000 0000 0000 0000 0000 0000 0000 0003 0000
170: 0000 0000 0000 0000 0000 0000 0000 0000 0000 0000
180: 0000 0000 0000 0000 0000 0000 0000 0000 0000 0000
190: 0000 0000 0000 0000 0000 0000 0000 0000 0000 0000
200: 0000 0000 0000 0000 0000 0000 303D 0000 0000 4000
210: 0000 0000 0000 0000 0000 0000 0000 1C20 0000 0000
220: 0000 0000 107E 0000 0000 0000 0000 0000 0000 0000
230: 0000 0000 0000 0000 0001 1000 0000 0000 0000 0000
240: 0000 0000 0000 0000 0000 0000 0000 0000 0000 0000
250: 0000 0000 0000 0000 0000 E6A5

-- SMART_READ_DATA ---------------------------------------------------------
     +0 +1 +2 +3 +4 +5 +6 +7 +8 +9 +A +B +C +D +E +F
000: 10 00 01 2F 00 C8 C8 00 00 00 00 00 00 00 03 27
010: 00 97 8F 99 05 00 00 00 00 00 04 32 00 5C 5C 5A
020: 21 00 00 00 00 00 05 33 00 C8 C8 00 00 00 00 00
030: 00 00 07 2F 00 C8 C8 00 00 00 00 00 00 00 09 32
040: 00 5E 5E E1 13 00 00 00 00 00 0A 33 00 64 64 00
050: 00 00 00 00 00 00 0B 32 00 64 64 00 00 00 00 00
060: 00 00 0C 32 00 62 62 C9 09 00 00 00 00 00 B7 32
070: 00 64 64 00 00 00 00 00 00 00 B8 33 00 64 64 00
080: 00 00 00 00 00 00 BB 32 00 64 63 01 00 00 00 00
090: 00 00 BC 32 00 64 64 00 00 00 00 00 00 00 BE 22
0A0: 00 44 35 20 00 1E 22 00 00 00 BF 32 00 01 01 8E
0B0: 01 00 00 00 00 00 C0 32 00 C8 C8 98 02 00 00 00
0C0: 00 00 C1 32 00 C5 C5 A1 24 00 00 00 00 00 C2 22
0D0: 00 6F 60 20 00 00 00 00 00 00 C4 32 00 C8 C8 00
0E0: 00 00 00 00 00 00 C5 32 00 C8 C8 00 00 00 00 00
0F0: 00 00 C6 30 00 64 FD 00 00 00 00 00 00 00 C7 32
100: 00 C8 C8 00 00 00 00 00 00 00 C8 09 00 64 FD 00
110: 00 00 00 00 00 00 00 00 00 00 00 00 00 00 00 00
120: 00 00 00 00 00 00 00 00 00 00 00 00 00 00 00 00
130: 00 00 00 00 00 00 00 00 00 00 00 00 00 00 00 00
140: 00 00 00 00 00 00 00 00 00 00 00 00 00 00 00 00
150: 00 00 00 00 00 00 00 00 00 00 00 00 00 00 00 00
160: 00 00 00 00 00 00 00 00 00 00 00 00 40 1A 01 51
170: 03 00 01 00 02 4F 00 00 00 00 00 00 00 00 00 00
180: 00 00 01 02 00 00 00 00 00 00 00 00 00 00 00 00
190: 00 00 00 00 00 00 00 00 00 00 00 00 00 00 00 00
1A0: 00 00 00 00 00 00 00 00 00 00 00 00 00 00 00 00
1B0: 00 00 00 00 00 00 00 00 00 00 00 00 00 00 00 00
1C0: 00 00 00 00 00 00 00 00 00 00 00 00 00 00 00 00
1D0: 00 00 00 00 00 00 00 00 00 00 00 00 00 00 00 00
1E0: 00 00 00 00 00 00 00 00 00 00 00 00 00 00 00 00
1F0: 00 00 00 00 00 00 00 00 00 00 00 00 00 00 00 24

-- SMART_READ_THRESHOLD ----------------------------------------------------
     +0 +1 +2 +3 +4 +5 +6 +7 +8 +9 +A +B +C +D +E +F
000: 10 00 01 33 C8 C8 00 00 00 00 00 00 00 00 03 15
010: 00 00 00 00 00 00 00 00 00 00 04 00 00 00 00 00
020: 00 00 00 00 00 00 05 8C 00 00 00 00 00 00 00 00
030: 00 00 07 33 C8 C8 00 00 00 00 00 00 00 00 09 00
040: 00 00 00 00 00 00 00 00 00 00 0A 33 00 00 00 00
050: 00 00 00 00 00 00 0B 00 00 00 00 00 00 00 00 00
060: 00 00 0C 00 00 00 00 00 00 00 00 00 00 00 B7 00
070: 00 00 00 00 00 00 00 00 00 00 B8 61 00 00 00 00
080: 00 00 00 00 00 00 BB 00 00 00 00 00 00 00 00 00
090: 00 00 BC 00 00 00 00 00 00 00 00 00 00 00 BE 28
0A0: 00 00 00 00 00 00 00 00 00 00 BF 00 00 00 00 00
0B0: 00 00 00 00 00 00 C0 00 00 00 00 00 00 00 00 00
0C0: 00 00 C1 00 00 00 00 00 00 00 00 00 00 00 C2 00
0D0: 00 00 00 00 00 00 00 00 00 00 C4 00 00 00 00 00
0E0: 00 00 00 00 00 00 C5 00 00 00 00 00 00 00 00 00
0F0: 00 00 C6 00 00 00 00 00 00 00 00 00 00 00 C7 00
100: 00 00 00 00 00 00 00 00 00 00 C8 33 00 00 00 00
110: 00 00 00 00 00 00 00 00 00 00 00 00 00 00 00 00
120: 00 00 00 00 00 00 00 00 00 00 00 00 00 00 00 00
130: 00 00 00 00 00 00 00 00 00 00 00 00 00 00 00 00
140: 00 00 00 00 00 00 00 00 00 00 00 00 00 00 00 00
150: 00 00 00 00 00 00 00 00 00 00 00 00 00 00 00 00
160: 00 00 00 00 00 00 00 00 00 00 00 00 00 00 00 00
170: 00 00 00 00 00 00 00 00 00 00 00 00 00 00 00 00
180: 00 00 00 00 00 00 00 00 00 00 00 00 00 00 00 00
190: 00 00 00 00 00 00 00 00 00 00 00 00 00 00 00 00
1A0: 00 00 00 00 00 00 00 00 00 00 00 00 00 00 00 00
1B0: 00 00 00 00 00 00 00 00 00 00 00 00 00 00 00 00
1C0: 00 00 00 00 00 00 00 00 00 00 00 00 00 00 00 00
1D0: 00 00 00 00 00 00 00 00 00 00 00 00 00 00 00 00
1E0: 00 00 00 00 00 00 00 00 00 00 00 00 00 00 00 00
1F0: 00 00 00 00 00 00 00 00 00 00 00 00 00 00 00 18

